{
  "schema_version": 1,
  "t": 1791806400000,
  "surface": "strip",
  "viewport": {
    "w": 1280,
    "h": 400
  },
  "scale": 2,
  "rects": [
    {
      "x": 0,
      "y": 8,
      "w": 80,
      "h": 32,
      "kind": "resident"
    },
    {
      "x": 100,
      "y": 8,
      "w": 80,
      "h": 32,
      "kind": "building"
    }
  ]
}
