{
  "schema_version": 1,
  "t": 1791806400000,
  "surface": "strip",
  "viewport": {
    "w": 1280,
    "h": 400
  },
  "scale": 2,
  "rects": [
    {
      "x": 0,
      "y": 8,
      "w": 80,
      "h": 32,
      "kind": "resident"
    },
    {
      "x": 100,
      "y": 8,
      "w": 80,
      "h": 32,
      "kind": "building"
    },
    {
      "x": 200,
      "y": 8,
      "w": 80,
      "h": 32,
      "kind": "bell"
    },
    {
      "x": 300,
      "y": 8,
      "w": 80,
      "h": 32,
      "kind": "card"
    },
    {
      "x": 400,
      "y": 8,
      "w": 80,
      "h": 32,
      "kind": "ui"
    },
    {
      "x": 500,
      "y": 8,
      "w": 80,
      "h": 32,
      "kind": "other"
    },
    {
      "x": 600,
      "y": 8,
      "w": 80,
      "h": 32,
      "kind": "resident"
    },
    {
      "x": 700,
      "y": 8,
      "w": 80,
      "h": 32,
      "kind": "building"
    },
    {
      "x": 800,
      "y": 8,
      "w": 80,
      "h": 32,
      "kind": "bell"
    },
    {
      "x": 900,
      "y": 8,
      "w": 80,
      "h": 32,
      "kind": "card"
    },
    {
      "x": 1000,
      "y": 8,
      "w": 80,
      "h": 32,
      "kind": "ui"
    },
    {
      "x": 1100,
      "y": 8,
      "w": 80,
      "h": 32,
      "kind": "other"
    },
    {
      "x": 0,
      "y": 48,
      "w": 80,
      "h": 32,
      "kind": "resident"
    },
    {
      "x": 100,
      "y": 48,
      "w": 80,
      "h": 32,
      "kind": "building"
    },
    {
      "x": 200,
      "y": 48,
      "w": 80,
      "h": 32,
      "kind": "bell"
    },
    {
      "x": 300,
      "y": 48,
      "w": 80,
      "h": 32,
      "kind": "card"
    },
    {
      "x": 400,
      "y": 48,
      "w": 80,
      "h": 32,
      "kind": "ui"
    },
    {
      "x": 500,
      "y": 48,
      "w": 80,
      "h": 32,
      "kind": "other"
    },
    {
      "x": 600,
      "y": 48,
      "w": 80,
      "h": 32,
      "kind": "resident"
    },
    {
      "x": 700,
      "y": 48,
      "w": 80,
      "h": 32,
      "kind": "building"
    },
    {
      "x": 800,
      "y": 48,
      "w": 80,
      "h": 32,
      "kind": "bell"
    },
    {
      "x": 900,
      "y": 48,
      "w": 80,
      "h": 32,
      "kind": "card"
    },
    {
      "x": 1000,
      "y": 48,
      "w": 80,
      "h": 32,
      "kind": "ui"
    },
    {
      "x": 1100,
      "y": 48,
      "w": 80,
      "h": 32,
      "kind": "other"
    },
    {
      "x": 0,
      "y": 88,
      "w": 80,
      "h": 32,
      "kind": "resident"
    },
    {
      "x": 100,
      "y": 88,
      "w": 80,
      "h": 32,
      "kind": "building"
    },
    {
      "x": 200,
      "y": 88,
      "w": 80,
      "h": 32,
      "kind": "bell"
    },
    {
      "x": 300,
      "y": 88,
      "w": 80,
      "h": 32,
      "kind": "card"
    },
    {
      "x": 400,
      "y": 88,
      "w": 80,
      "h": 32,
      "kind": "ui"
    },
    {
      "x": 500,
      "y": 88,
      "w": 80,
      "h": 32,
      "kind": "other"
    },
    {
      "x": 600,
      "y": 88,
      "w": 80,
      "h": 32,
      "kind": "resident"
    },
    {
      "x": 700,
      "y": 88,
      "w": 80,
      "h": 32,
      "kind": "building"
    }
  ]
}
